{
  "job_id": "job_01",
  "attempt_id": "attempt_01",
  "status": "queued",
  "created_at": "2026-09-13T13:00:00Z",
  "idempotency_replay": false,
  "links": {
    "self": "/v1/workspaces/workspace_01/jobs/job_01",
    "events": "/v1/workspaces/workspace_01/jobs/job_01/events",
    "attempts": "/v1/workspaces/workspace_01/jobs/job_01/attempts",
    "artifacts": "/v1/workspaces/workspace_01/jobs/job_01/artifacts"
  }
}
